{
  "id": "aerometric.quadrotor-v3",
  "version": "0.1.0",
  "label": "Quadrotor V3",
  "units": "meter",
  "forwardAxis": "+Z",
  "roles": {
    "root": ["DRONE_ROOT"],
    "body": ["Body_Main", "Body_FrontSection", "Body_Bottom", "Body_Side_L", "Body_Side_R"],
    "topCover": ["Body_TopCover"],
    "arms": ["ARM_FL", "ARM_FR", "ARM_RL", "ARM_RR"],
    "motors": ["MOTOR_FL", "MOTOR_FR", "MOTOR_RL", "MOTOR_RR"],
    "rotor.frontLeft": ["ROTOR_FL"],
    "rotor.frontRight": ["ROTOR_FR"],
    "rotor.rearLeft": ["ROTOR_RL"],
    "rotor.rearRight": ["ROTOR_RR"],
    "landingGear": ["LANDING_GEAR"],
    "gimbal": ["GIMBAL_ROOT"],
    "gimbal.yaw": ["Gimbal_Yaw"],
    "gimbal.pitch": ["Gimbal_Pitch"],
    "camera": ["Camera_Main"],
    "light.frontLeft": ["FrontLight_Diffuser_L"],
    "light.frontRight": ["FrontLight_Diffuser_R"],
    "light.motorFrontLeft": ["StatusLight_FL"],
    "light.motorFrontRight": ["StatusLight_FR"],
    "light.motorRearLeft": ["StatusLight_RL"],
    "light.motorRearRight": ["StatusLight_RR"]
  },
  "capabilities": {
    "partColors": true,
    "partVisibility": true,
    "rotorControl": true,
    "gimbalControl": true,
    "statusLights": true,
    "statusField": true
  },
  "metadata": {
    "triangles": 57524,
    "profileStatus": "example"
  }
}
