{
  "id": "aerometric-reference-drone-01",
  "version": "0.1.0",
  "label": "AEROMETRIC Reference Drone 01",
  "units": "meter",
  "forwardAxis": "-Z",
  "roles": {
    "root": [
      "DRONE_ROOT"
    ],
    "body": [
      "Body_Main",
      "Belly_Plate"
    ],
    "topCover": [
      "Body_TopCover"
    ],
    "arms": [
      "ARM_FL",
      "ARM_FR",
      "ARM_RL",
      "ARM_RR"
    ],
    "motors": [
      "Motor_Housing_FL",
      "Motor_Housing_FR",
      "Motor_Housing_RL",
      "Motor_Housing_RR",
      "Motor_Cap_FL",
      "Motor_Cap_FR",
      "Motor_Cap_RL",
      "Motor_Cap_RR"
    ],
    "rotor.frontLeft": [
      "ROTOR_FL"
    ],
    "rotor.frontRight": [
      "ROTOR_FR"
    ],
    "rotor.rearLeft": [
      "ROTOR_RL"
    ],
    "rotor.rearRight": [
      "ROTOR_RR"
    ],
    "landingGear": [
      "LANDING_GEAR"
    ],
    "gimbal": [
      "GIMBAL_ROOT"
    ],
    "gimbal.yaw": [
      "Gimbal_Yaw"
    ],
    "gimbal.pitch": [
      "Gimbal_Pitch"
    ],
    "camera": [
      "Camera_Main"
    ],
    "light.frontLeft": [
      "FrontLight_Diffuser_L"
    ],
    "light.frontRight": [
      "FrontLight_Diffuser_R"
    ],
    "light.motorFrontLeft": [
      "StatusLight_FL"
    ],
    "light.motorFrontRight": [
      "StatusLight_FR"
    ],
    "light.motorRearLeft": [
      "StatusLight_RL"
    ],
    "light.motorRearRight": [
      "StatusLight_RR"
    ]
  },
  "capabilities": {
    "partColors": true,
    "partVisibility": true,
    "rotorControl": true,
    "gimbalControl": true,
    "statusLights": true,
    "statusField": true
  },
  "metadata": {
    "origin": "Generated by the repository Blender script from native primitives; no external assets",
    "generator": "release/aerometric-0.1/blender/build_reference_drone_01.py"
  }
}
